{
  "contract": {"name": "hausman-hasc-climate-registry-preview", "version": 1},
  "status": "ready",
  "save_allowed": true,
  "fresh": true,
  "registry": {"version": 1, "room_count": 2, "device_count": 2},
  "reconciliation": {
    "matches": true,
    "matched_device_count": 2,
    "missing_device_count": 0,
    "room_mismatch_device_count": 0,
    "unregistered_source_count": 0
  },
  "reasons": []
}
